{
  "task_id": "D-0025-W",
  "source_backlog_ref": "github:issue/31",
  "source_backlog_commit": "19097d5aeda720fe2b688ac945be8eacee383686",
  "repository": "mrhz1973/control-plane",
  "branch_target": "main",
  "goal": "Offline LiteLLM primary cycle runner validation.",
  "risk_hint": "low",
  "complexity_hint": "low",
  "planner_requested": "codex",
  "allowed_paths": [
    "tools/run-litellm-primary-cycle.mjs",
    "tests/litellm-primary-cycle/"
  ],
  "forbidden_paths": [
    "n8n",
    "OpenClaw runtime",
    "VPS"
  ],
  "acceptance_seed": [
    "prepare PASS",
    "finalize PASS"
  ],
  "validation_seed": [
    "node tests/litellm-primary-cycle/run.mjs"
  ],
  "hard_constraints": [
    "no-n8n-mutation",
    "no-provider-calls"
  ]
}
